<!-- DSpace Custom Submit input form definition language -->


 <!ELEMENT input-forms (form-map, form-definitions, form-definitions-extra, form-value-pairs, form-complex-definitions) >

 <!ELEMENT form-map (name-map)* >
 <!ELEMENT name-map EMPTY >
 <!ATTLIST name-map 
           collection-handle CDATA #REQUIRED
           form-name NMTOKEN #REQUIRED>

 <!ELEMENT form-definitions (form)+ >
 <!ELEMENT form-definitions-extra (form)+ >
 <!ELEMENT form-complex-definitions (definition)+ >
 <!ELEMENT form (page)+ >
 <!ATTLIST form name NMTOKEN #REQUIRED>
 <!ELEMENT page (field)+ >
 <!ATTLIST page number NMTOKEN #REQUIRED>
 <!ELEMENT field (dc-schema, dc-element, dc-qualifier?, repeatable?, visibility?,
         repeatable-component?, repeatable-parse?,
         mapped-to?, label, type-bind?, input-type, hint, autocomplete?, required?, placeholder?,
         vocabulary?, regexp?, regexp-warning?, additional?, component-label?, collapsible?, acl?, class?) >
 <!ELEMENT definition (input*) >
 <!ATTLIST definition
        name CDATA #REQUIRED
        >

 <!ELEMENT dc-schema (#PCDATA) >
 <!ELEMENT dc-element (#PCDATA) >
 <!ELEMENT dc-qualifier (#PCDATA) >
 <!ELEMENT type-bind (#PCDATA) >
 <!ATTLIST type-bind field CDATA #IMPLIED >
 
 <!ELEMENT repeatable (#PCDATA) >
 <!ELEMENT repeatable-component (#PCDATA) >
 <!ELEMENT repeatable-parse (#PCDATA) >
 <!ELEMENT autocomplete (#PCDATA) >
 <!ELEMENT mapped-to (#PCDATA) >
 <!ELEMENT label (#PCDATA) >
 <!ELEMENT additional (#PCDATA) >
 <!ELEMENT component-label (#PCDATA) >
 <!ELEMENT collapsible (#PCDATA) >
 <!ELEMENT input-type (#PCDATA)>

 <!ELEMENT input (#PCDATA) >
 <!ATTLIST input type CDATA #REQUIRED >
 <!ATTLIST input name CDATA #REQUIRED >
 <!ATTLIST input label CDATA #IMPLIED >
 <!ATTLIST input regexp CDATA #IMPLIED >
 <!ATTLIST input pairs CDATA #IMPLIED >
 <!ATTLIST input help CDATA #IMPLIED >
 <!ATTLIST input autocomplete CDATA #IMPLIED >
 <!ATTLIST input placeholder CDATA #IMPLIED >
 <!ATTLIST input id CDATA #IMPLIED >
 <!ATTLIST input class CDATA #IMPLIED >
 <!ATTLIST input readonly CDATA #IMPLIED >
 <!ATTLIST input mapped-to-if-not-default CDATA #IMPLIED >
 <!ATTLIST input value CDATA #IMPLIED >
 <!ATTLIST input required CDATA #IMPLIED >

 <!ELEMENT hint (#PCDATA) >
 <!ELEMENT required (#PCDATA)>

 <!ELEMENT form-value-pairs (value-pairs)* >
 <!ELEMENT value-pairs (pair)+ >

 <!-- will be used in  String.matches, so mind proper escaping -->
 <!ELEMENT regexp (#PCDATA) >
 <!ELEMENT regexp-warning (#PCDATA) >

 <!ELEMENT placeholder (#PCDATA) >

 <!--
      ACL element for fine-grained access control 
      the content should be semicolon separated list of entries in format matching the following regexp:
      policy=(allow|deny),action=(read|write),grantee-type=(user|group),grantee-id=(\d+,\*) 
 -->
 <!ELEMENT acl (#PCDATA)>
 <!ELEMENT class (#PCDATA) >
 
 <!-- ***
        To assign a particular 'value-pairs' list to a particular dropdown 'input-type'
        field, as found on a particular form, put:
        - value-pairs/@value-pairs-name string into
           form/page/field/input-type/@value-pairs-name
        - form/page/field/@DCelement + '_' + form/field/DCqualifier into
           value-pairs/@dc-term
             (e.g. 'language_iso')
  -->
 <!ATTLIST value-pairs value-pairs-name CDATA #REQUIRED
                            dc-term   CDATA #REQUIRED
 >
  
 <!ELEMENT pair (displayed-value,stored-value) >
 <!ELEMENT displayed-value (#PCDATA)>
 <!ELEMENT stored-value (#PCDATA)>

 <!ATTLIST input-type value-pairs-name CDATA  #IMPLIED>

 <!ATTLIST input-type complex-definition-ref CDATA  #IMPLIED>

 <!ELEMENT vocabulary (#PCDATA) >

 <!ATTLIST vocabulary closed (true|false) "false"> 

 <!ELEMENT visibility (#PCDATA) >
